Titre,Auteur,Date,URL/ID,Texte,Type
"I’ve found a few funny memories during lockdown. This is from my 1st tour in 89, backstage in Vegas.",ReallyRickAstley,2020/06/17,https://www.reddit.com//r/pics/comments/haucpf/ive_found_a_few_funny_memories_during_lockdown/,,Reddit
Times Square right now,SomeGuyInDeutschland,2021/01/30,https://www.reddit.com//r/wallstreetbets/comments/l8rf4k/times_square_right_now/,,Reddit
Joe Biden elected president of the United States,throwawaynumber53,2020/11/07,https://www.reddit.com//r/news/comments/jptqj9/joe_biden_elected_president_of_the_united_states/,,Reddit
"The Senate. Upvote this so that people see it when they Google ""The Senate"".",serventofgaben,2017/04/01,https://www.reddit.com//r/movies/comments/62sjuh/the_senate_upvote_this_so_that_people_see_it_when/,,Reddit
My cab driver tonight was so excited to share with me that he’d made the cover of the calendar. I told him I’d help let the world see,the_Diva,2017/12/28,https://www.reddit.com//r/funny/comments/7mjw12/my_cab_driver_tonight_was_so_excited_to_share/,,Reddit
UPVOTE so everyone sees we got SUPPORT,vrweensy,2021/01/28,https://www.reddit.com//r/wallstreetbets/comments/l6wu59/upvote_so_everyone_sees_we_got_support/,,Reddit
A short story,rextraneous,2020/06/07,https://www.reddit.com//r/memes/comments/gyfedz/a_short_story/,,Reddit
Guardians of the Front Page,iH8myPP,2016/12/05,https://www.reddit.com//r/funny/comments/5gn8ru/guardians_of_the_front_page/,,Reddit
This is what happens when one company owns dozens of local news stations,patientbearr,2018/03/31,https://www.reddit.com//r/videos/comments/88ll08/this_is_what_happens_when_one_company_owns_dozens/,,Reddit
Heat index was 110 degrees so we offered him a cold drink. He went for a full body soak instead,FootLoosePickleJuice,2018/07/20,https://www.reddit.com//r/aww/comments/90bu6w/heat_index_was_110_degrees_so_we_offered_him_a/,,Reddit
GME YOLO update — Jan 28 2021,DeepFuckingValue,2021/01/28,https://www.reddit.com//r/wallstreetbets/comments/l78uct/gme_yolo_update_jan_28_2021/,,Reddit
If this is you: Fuck you,onyxandcake,2020/03/13,https://www.reddit.com//r/pics/comments/fi2zjs/if_this_is_you_fuck_you/,,Reddit
She did her best ok?,BlackAdder7,2020/08/25,https://www.reddit.com//r/memes/comments/ig9u4z/she_did_her_best_ok/,,Reddit
"Take your time, you got this",SrGrafo,2019/07/13,https://www.reddit.com//r/gaming/comments/ccr8c8/take_your_time_you_got_this/,,Reddit
Leaked Drone footage of shackled and blindfolded Uighur Muslims led from trains. As a German this is especially chilling.,i_hate_kitten,2020/07/15,https://www.reddit.com//r/gifs/comments/hrpgzt/leaked_drone_footage_of_shackled_and_blindfolded/,,Reddit
"""Everybody's trying to shame us""",None,2020/06/09,https://www.reddit.com//r/PublicFreakout/comments/gzvmsr/everybodys_trying_to_shame_us/,,Reddit
"Private Internet Access, a VPN provider, takes out a full page ad in The New York Time calling out 50 senators.",pdmcmahon,2017/03/26,https://www.reddit.com//r/pics/comments/61ns2w/private_internet_access_a_vpn_provider_takes_out/,,Reddit
At a protest in Arizona,Theon_Graystark,2020/06/09,https://www.reddit.com//r/pics/comments/gzn8tj/at_a_protest_in_arizona/,,Reddit
"Meet the newest member of the family, Dutch!",GovSchwarzenegger,2020/07/28,https://www.reddit.com//r/aww/comments/hzkbop/meet_the_newest_member_of_the_family_dutch/,,Reddit
"My dad waits every year for the day the sun rises just right and reflects along the railroad tracks, Today was that day!",Tibujon,2017/09/10,https://www.reddit.com//r/pics/comments/6z699p/my_dad_waits_every_year_for_the_day_the_sun_rises/,,Reddit
This house ain’t big enough for the six of us,theonlymexicanman,2020/03/15,https://www.reddit.com//r/memes/comments/fj45ih/this_house_aint_big_enough_for_the_six_of_us/,,Reddit
GME YOLO month-end update — Jan 2021,DeepFuckingValue,2021/01/29,https://www.reddit.com//r/wallstreetbets/comments/l846a1/gme_yolo_monthend_update_jan_2021/,,Reddit
They what???,GGezpzMuppy,2020/05/12,https://www.reddit.com//r/memes/comments/gi8l07/they_what/,,Reddit
"Ever since my niece saw Toy Story, she shouts “I’m leaving!” and then peeks at her room like this",finestjun,2019/12/29,https://www.reddit.com//r/aww/comments/ehb706/ever_since_my_niece_saw_toy_story_she_shouts_im/,,Reddit
"Twelve years ago, the world was bankrupted and Wall Street celebrated with champagne.",a-horse-has-no-name,2021/01/28,https://www.reddit.com//r/pics/comments/l77fdv/twelve_years_ago_the_world_was_bankrupted_and/,,Reddit
The conversation my son and I will have on Christmas Eve.,Romobyl,2017/12/19,https://www.reddit.com//r/funny/comments/7kvjuz/the_conversation_my_son_and_i_will_have_on/,,Reddit
Oregon wildfires making it look straight apocalyptic,RavenRosie,2020/09/08,https://www.reddit.com//r/pics/comments/ioyntd/oregon_wildfires_making_it_look_straight/,,Reddit
"2500 mile flight, 2 hour drive, 6 hour hike, and my wife is at rest.",MECHASCHMECK,2020/03/04,https://www.reddit.com//r/pics/comments/fdemc6/2500_mile_flight_2_hour_drive_6_hour_hike_and_my/,,Reddit
This man jogged 2 miles through his neighborhood carrying a TV in his hands to prove that “looking like a suspect” who committed a robbery isn’t a good enough excuse for the murder of Ahmaud Arbery. Neighbors waived hello to him as he jogged.,GallowBoob,2020/05/10,https://www.reddit.com//r/nextfuckinglevel/comments/gh5c5i/this_man_jogged_2_miles_through_his_neighborhood/,,Reddit
Every day General Grievous adds a unique lightsaber to his collection. Day 66(Finale): Every u/Raymesiris suggestion.,Thibson34,2020/04/14,https://www.reddit.com//r/PrequelMemes/comments/g15hel/every_day_general_grievous_adds_a_unique/,,Reddit
President Donald Trump says he has tested positive for coronavirus,hoosakiwi,2020/10/02,https://www.reddit.com//r/news/comments/j3oj21/president_donald_trump_says_he_has_tested/,,Reddit
First day of school in a Georgia town. One of the biggest virus hot zones in the world.,None,2020/08/04,https://www.reddit.com//r/pics/comments/i3izcv/first_day_of_school_in_a_georgia_town_one_of_the/,,Reddit
"Thanks, Obama.",Itsjorgehernandez,2016/11/09,https://www.reddit.com//r/pics/comments/5bx4bx/thanks_obama/,,Reddit
"In England you sometimes see these ""wavy"" brick fences. And curious as it may seem, this shape uses FEWER bricks than a straight wall. A straight wall needs at least two layers of bricks to make is sturdy, but the wavy wall is fine thanks to the arch support provided by the waves.",smell1s,2020/06/03,https://www.reddit.com//r/interestingasfuck/comments/gw1jbg/in_england_you_sometimes_see_these_wavy_brick/,,Reddit
"Given that reddit just took a $150 million investment from a Chinese censorship powerhouse, I thought it would be nice to post this picture of ""Tank Man"" at Tienanmen Square before our new glorious overlords decide we cannot post it anymore.",FreeSpeechWarrior,2019/02/08,https://www.reddit.com//r/pics/comments/aohpmo/given_that_reddit_just_took_a_150_million/,,Reddit
My parents (late 70s) got me a ps5 controller for Christmas. I do not own a playstation 5...,Yabba_Dabbs,2020/12/25,https://www.reddit.com//r/gaming/comments/kk478s/my_parents_late_70s_got_me_a_ps5_controller_for/,,Reddit
I got off the horse by accident right before a cutscene in red dead,springfart,2018/12/01,https://www.reddit.com//r/gaming/comments/a1yofz/i_got_off_the_horse_by_accident_right_before_a/,,Reddit
Blizzard Employees Staged a Walkout After the Company Banned a Gamer for Pro-Hong Kong Views,SageMo,2019/10/09,https://www.reddit.com//r/news/comments/dfn3yi/blizzard_employees_staged_a_walkout_after_the/,,Reddit
This pencil drawing took me over 250 hours to complete.,keeganhall,2020/10/06,https://www.reddit.com//r/nextfuckinglevel/comments/j6ed00/this_pencil_drawing_took_me_over_250_hours_to/,,Reddit
The Denver Broncos have the entire town of ‘South Park’ in the stands for today’s NFL game.,Exclamation_Marc,2020/09/27,https://www.reddit.com//r/funny/comments/j0w79j/the_denver_broncos_have_the_entire_town_of_south/,,Reddit
I feel privileged,blityc,2020/11/03,https://www.reddit.com//r/memes/comments/jnbc9d/i_feel_privileged/,,Reddit
"I carved and gifted the ""Terminator pipe"" to Arnold birthday and he sent me a photo.",RadonLab,2020/09/02,https://www.reddit.com//r/nextfuckinglevel/comments/il4o88/i_carved_and_gifted_the_terminator_pipe_to_arnold/,,Reddit
This is the worst picture ever taken of me,TurnipTimeMyGuys,2020/06/13,https://www.reddit.com//r/pics/comments/h8br11/this_is_the_worst_picture_ever_taken_of_me/,,Reddit
DEMOCRACY NOW,foxeydog,2019/08/12,https://www.reddit.com//r/pics/comments/cp4sce/democracy_now/,,Reddit
"After 11 hospital days and losing 12kg, my 78yr old dad is home and recovered from Covid in Madrid!",notmelaniatrump,2020/03/29,https://www.reddit.com//r/pics/comments/fqwind/after_11_hospital_days_and_losing_12kg_my_78yr/,,Reddit
"This is Shelia Fredrick, a flight attendant. She noticed a terrified girl accompanied by an older man. She left a note in the bathroom on which the victim wrote that she needed help. The police was alerted & the girl was saved from a human trafficker. We should honor our heroes.",None,2017/02/06,https://www.reddit.com//r/pics/comments/5sfexx/this_is_shelia_fredrick_a_flight_attendant_she/,,Reddit
"People who haven't pooped in 2019 yet, why are you still holding on to last years shit?",ShoddySubstance,2019/01/01,https://www.reddit.com//r/AskReddit/comments/ablzuq/people_who_havent_pooped_in_2019_yet_why_are_you/,,Reddit
We are doomed,Pringles__,2020/03/21,https://www.reddit.com//r/memes/comments/fmf637/we_are_doomed/,,Reddit
Printers,System32Comics,2019/09/10,https://www.reddit.com//r/funny/comments/d2bwot/printers/,,Reddit
"CLASS ACTION AGAINST ROBINHOOD. Allowing people to only sell is the definition of market manipulation. A class action must be started, Robinhood has made plenty of money off selling info about our trades to the hedge funds to be able to pay out a little for causing people to loose money now",does-it-mater,2021/01/28,https://www.reddit.com//r/wallstreetbets/comments/l6x130/class_action_against_robinhood_allowing_people_to/,"LEAVE ROBINHOOD. They dont deserve to make money off us after the millions they caused in losses. It might take a couple of days, but send Robinhood to the ground and GME to the moon.",Reddit
Trump has left the White House for the last time as President,gumball_Jones,2021/01/20,https://www.reddit.com//r/news/comments/l18yys/trump_has_left_the_white_house_for_the_last_time/,,Reddit
It’s treason then,keenfeed,2021/01/30,https://www.reddit.com//r/wallstreetbets/comments/l881ia/its_treason_then/,,Reddit
Just increased my car’s value by 1 billion dollars,RudyWillingham,2020/07/31,https://www.reddit.com//r/funny/comments/i0wgoo/just_increased_my_cars_value_by_1_billion_dollars/,,Reddit
Whoever created the tradition of not seeing the bride in the wedding dress beforehand saved countless husbands everywhere from hours of dress shopping and will forever be a hero to all men.,Yorkshire45,2019/02/09,https://www.reddit.com//r/Showerthoughts/comments/aonp75/whoever_created_the_tradition_of_not_seeing_the/,Damn... this got big...,Reddit
How it started and how it’s going,DaFunkJunkie,2021/01/09,https://www.reddit.com//r/pics/comments/ktrcoo/how_it_started_and_how_its_going/,,Reddit
Hmmmmmmmmmm,Zlecklamar,2020/06/21,https://www.reddit.com//r/memes/comments/hd6nhx/hmmmmmmmmmm/,,Reddit
Nickelodeon went off the air for a full 8 minutes and 46 seconds to protest police brutality,Speedbird235,2020/06/02,https://www.reddit.com//r/nextfuckinglevel/comments/guua33/nickelodeon_went_off_the_air_for_a_full_8_minutes/,,Reddit
"Local Mexican restaurant used to be a Chinese restaurant. Instead of painting over a mural, they just put sombreros on the pandas.",Bombaskos,2018/01/31,https://www.reddit.com//r/mildlyinteresting/comments/7ub9ax/local_mexican_restaurant_used_to_be_a_chinese/,,Reddit
My grandma wanted some “creative” grad photos of my friend since we’re graduating at the same time. This was her least favorite,Toll_House69,2020/05/05,https://www.reddit.com//r/funny/comments/ge4l65/my_grandma_wanted_some_creative_grad_photos_of_my/,,Reddit
"I am Barack Obama, President of the United States -- AMA",PresidentObama,2012/08/29,https://www.reddit.com//r/IAmA/comments/z1c9z/i_am_barack_obama_president_of_the_united_states/,"Hi, I’m Barack Obama, President of the United States. Ask me anything. I’ll be taking your questions for half an hour starting at about 4:30 ET.Proof it's me: https://twitter.com/BarackObama/status/240903767350968320We're running early and will get started soon.UPDATE: Hey everybody - this is barack. Just finished a great rally in Charlottesville, and am looking forward to your questions. At the top, I do want to say that our thoughts and prayers are with folks who are dealing with Hurricane Isaac in the Gulf, and to let them know that we are going to be coordinating with state and local officials to make sure that we give families everything they need to recover.Verification photo: http://i.imgur.com/oz0a7.jpgLAST UPDATE: I need to get going so I'm back in DC in time for dinner. But I want to thank everybody at reddit for participating - this is an example of how technology and the internet can empower the sorts of conversations that strengthen our democracy over the long run. AND REMEMBER TO VOTE IN NOVEMBER - if you need to know how to register, go to http://gottaregister.com. By the way, if you want to know what I think about this whole reddit experience - NOT BAD!http://www.barackobama.com/reddit[edit: link fixed by staff]",Reddit
"A man of focus, commitment and sheer will",MohanBhargava,2020/06/08,https://www.reddit.com//r/nextfuckinglevel/comments/gyxtur/a_man_of_focus_commitment_and_sheer_will/,,Reddit
This person sold their VHS player on eBay and got a surprise letter in the mailbox.,effectivepep,2019/02/17,https://www.reddit.com//r/pics/comments/arfjs5/this_person_sold_their_vhs_player_on_ebay_and_got/,,Reddit
This is Dr Katie Bouman the computer scientist behind the first ever image of a black-hole. She developed the algorithm that turned telescopic data into the historic photo we see today.,iKojan,2019/04/10,https://www.reddit.com//r/pics/comments/bbql1i/this_is_dr_katie_bouman_the_computer_scientist/,,Reddit
Bunnies flop over when they feel completely safe,iamnobodyelsel,2020/02/02,https://www.reddit.com//r/aww/comments/exng3g/bunnies_flop_over_when_they_feel_completely_safe/,,Reddit
I decided to finally go vaccinated behind my anti-vax parent's back! :),tazijade,2020/03/18,https://www.reddit.com//r/pics/comments/fkq3qb/i_decided_to_finally_go_vaccinated_behind_my/,,Reddit
Who's Donald Biden?,kakara92,2020/11/05,https://www.reddit.com//r/memes/comments/jogzsr/whos_donald_biden/,,Reddit
Kobe Bryant killed in helicopter crash in California,headee,2020/01/26,https://www.reddit.com//r/news/comments/eubjfc/kobe_bryant_killed_in_helicopter_crash_in/,,Reddit
