Titre,Auteur,Date,URL/ID,Texte,Type
"Today, NASA will officially have to say goodbye to the little rover that could. The Mars Opportunity Rover was meant to last just 90 days and instead marched on for 14 years. It finally lost contact with earth after it was hit by a fierce dust storm.",iBlueSweatshirt,2019/02/13,https://www.reddit.com//r/pics/comments/aq8355/today_nasa_will_officially_have_to_say_goodbye_to/,,Reddit
This is my jam,achilles-_-23,2021/01/29,https://www.reddit.com//r/memes/comments/l7qap4/this_is_my_jam/,,Reddit
"The most challenging painting I've ever done titled ""Recover"" #BrushstrokesinTime",davidambart,2019/11/14,https://www.reddit.com//r/pics/comments/dwdllq/the_most_challenging_painting_ive_ever_done/,,Reddit
I overcame my depression and went for a hike :) It's the small things.,JesseD320,2020/12/12,https://www.reddit.com//r/pics/comments/kbxb0n/i_overcame_my_depression_and_went_for_a_hike_its/,,Reddit
"I'm 17 years old and just finished building this 14.7"" f/2.89 Newtonian reflector telescope. Despite its stubby size it collects roughly 2500 times more light than the human eye and is bigger than the scope at my local observatory.",__Augustus_,2020/03/29,https://www.reddit.com//r/space/comments/frdd1d/im_17_years_old_and_just_finished_building_this/,,Reddit
"Today one of my 4th grade students renamed himself ""reconecting ..."" on our Zoom call and pretended that he was having internet issues to avoid participating in our lesson.",reddericks,2020/05/11,https://www.reddit.com//r/funny/comments/ghujvl/today_one_of_my_4th_grade_students_renamed/,,Reddit
They secluded him behind a wall and looked around to see if anyone was watching so they can beat him... this is why we protest,SUPERGUESSOUS,2020/06/02,https://www.reddit.com//r/PublicFreakout/comments/gvdl01/they_secluded_him_behind_a_wall_and_looked_around/,,Reddit
Finland op,Dzigi14,2020/04/06,https://www.reddit.com//r/memes/comments/fw1ch6/finland_op/,,Reddit
"Picture of a political prisoner in one of China's internment camps, taken secretly by a family member.",takethi,2019/11/07,https://www.reddit.com//r/pics/comments/dsylqp/picture_of_a_political_prisoner_in_one_of_chinas/,,Reddit
"Prince Andrew says he's never met Virginia Giuffre, so here's them together with Ghislaine Maxwell",haroldas194,2020/07/12,https://www.reddit.com//r/pics/comments/hpj55g/prince_andrew_says_hes_never_met_virginia_giuffre/,,Reddit
"Used some of my GME tendies to buy Nintendo Switches from Gamestop, then donated them to a Children's Hospital. Got featured on the local news and brought glory to WSB.",mpwrd,2021/01/30,https://www.reddit.com//r/wallstreetbets/comments/l8c0u4/used_some_of_my_gme_tendies_to_buy_nintendo/,,Reddit
His first photo in the Oval Office,jcepiano,2021/01/21,https://www.reddit.com//r/pics/comments/l1l3er/his_first_photo_in_the_oval_office/,,Reddit
GME YOLO update — Feb 19 2021,DeepFuckingValue,2021/02/19,https://www.reddit.com//r/wallstreetbets/comments/lnqgz8/gme_yolo_update_feb_19_2021/,,Reddit
IT'S POWER TO THE TRADERS NOW,84935,2021/01/29,https://www.reddit.com//r/wallstreetbets/comments/l7feld/its_power_to_the_traders_now/,,Reddit
GME YOLO update — Jan 27 2021 --------------------------------------- guess i need 102 characters in title now,DeepFuckingValue,2021/01/27,https://www.reddit.com//r/wallstreetbets/comments/l6ekdz/gme_yolo_update_jan_27_2021_guess_i_need_102/,,Reddit
"And here it is: Likely the last sketch I'll ever post on Reddit. It's been a wild ride, guys and girls. Thanks for everything.",None,2017/05/30,https://www.reddit.com//r/pics/comments/6e7luk/and_here_it_is_likely_the_last_sketch_ill_ever/,,Reddit
I got a cease and desist for making the Crocs Gloves,rightcoastguy,2019/08/09,https://www.reddit.com//r/pics/comments/co6h3d/i_got_a_cease_and_desist_for_making_the_crocs/,,Reddit
GME YOLO update — Feb 1 2021,DeepFuckingValue,2021/02/01,https://www.reddit.com//r/wallstreetbets/comments/lae6j0/gme_yolo_update_feb_1_2021/,,Reddit
Reddit's Immigrants,iH8myPP,2017/07/29,https://www.reddit.com//r/funny/comments/6qatmn/reddits_immigrants/,,Reddit
The road to the White House just got a fresh paint job.,N301CF,2020/06/05,https://www.reddit.com//r/interestingasfuck/comments/gx6ol5/the_road_to_the_white_house_just_got_a_fresh/,,Reddit
They noticed there was a blank wall at mcdonald’s so they decided to make this fake poster of themselves. It’s now been 51 days since they hung it up.,Goal1,2018/09/03,https://www.reddit.com//r/pics/comments/9cmazx/they_noticed_there_was_a_blank_wall_at_mcdonalds/,,Reddit
It took so many hours,None,2020/08/08,https://www.reddit.com//r/memes/comments/i5zoq5/it_took_so_many_hours/,,Reddit
Sheep in Human Clothing,TheJenkinsComic,2020/07/28,https://www.reddit.com//r/funny/comments/hzd35i/sheep_in_human_clothing/,,Reddit
uncanny resemblance,PrettyCoolTim,2020/12/21,https://www.reddit.com//r/memes/comments/khiyao/uncanny_resemblance/,,Reddit
Simpsons predicted it yet again,heycanwedie,2019/09/26,https://www.reddit.com//r/memes/comments/d9gvok/simpsons_predicted_it_yet_again/,,Reddit
1 dad reflex 2 children,iswearidk,2016/12/22,https://www.reddit.com//r/gifs/comments/5jrlw1/1_dad_reflex_2_children/,,Reddit
Confusing,WhatTheMat,2020/08/31,https://www.reddit.com//r/memes/comments/ik0qu9/confusing/,,Reddit
Trump Impeached for Abuse of Power,MachoNachoTaco,2019/12/19,https://www.reddit.com//r/worldnews/comments/eclwg9/trump_impeached_for_abuse_of_power/,,Reddit
America's response to the COVID-19 global pandemic all boiled down to one picture,jcepiano,2020/06/28,https://www.reddit.com//r/pics/comments/hhgim2/americas_response_to_the_covid19_global_pandemic/,,Reddit
I took a few shots at Lake Louise today and Google offered me this panorama:,MalletsDarker,2018/01/18,https://www.reddit.com//r/funny/comments/7r9ptc/i_took_a_few_shots_at_lake_louise_today_and/,,Reddit
boy gamer,velabas,2021/03/01,https://www.reddit.com//r/gaming/comments/lvcakc/boy_gamer/,,Reddit
My kids came in and told me there was water coming from the laundry room. They said it looked like it started at the washer. I rushed in to find this. Buncha comedians in my house...,narcolepsyinc,2020/01/27,https://www.reddit.com//r/funny/comments/euntmz/my_kids_came_in_and_told_me_there_was_water/,,Reddit
