Titre,Auteur,Date,URL/ID,Texte,Type
Seattle road sign last night shares American sentiment,kebomim,2024/12/12,https://www.reddit.com//r/pics/comments/1hctlrs/seattle_road_sign_last_night_shares_american/,,Reddit
It turns out that was a lie all along,blllrrrrr,2024/12/12,https://www.reddit.com//r/MurderedByWords/comments/1hcslrb/it_turns_out_that_was_a_lie_all_along/,,Reddit
Two years ago I quit my job in IT and opened an arcade. Last week I opened the new location - double the size.,imvii,2024/12/12,https://www.reddit.com//r/MadeMeSmile/comments/1hctrq1/two_years_ago_i_quit_my_job_in_it_and_opened_an/,,Reddit
Weirdest 170,RebelliousDragon21,2024/12/12,https://www.reddit.com//r/Unexpected/comments/1hcqk7z/weirdest_170/,,Reddit
"Queue the ""Fell For It Again"" award",blllrrrrr,2024/12/12,https://www.reddit.com//r/facepalm/comments/1hcqwo7/queue_the_fell_for_it_again_award/,,Reddit
"She actually typed that up, re-read it and posted it.. wow",TheTargaryensLawyer,2024/12/12,https://www.reddit.com//r/BlackPeopleTwitter/comments/1hcrs0x/she_actually_typed_that_up_reread_it_and_posted/,,Reddit
Enrons new ceo was pied in nyc today,LonelyWolf_93,2024/12/12,https://www.reddit.com//r/interestingasfuck/comments/1hcw54d/enrons_new_ceo_was_pied_in_nyc_today/,,Reddit
'Wanted' CEO posters and other threats emerge after Mangione arrest,OkayButFoRealz,2024/12/12,https://www.reddit.com//r/news/comments/1hcpceb/wanted_ceo_posters_and_other_threats_emerge_after/,,Reddit
Trump Backtracks On Campaign Pledge To Bring Down Grocery Prices,IronyElSupremo,2024/12/12,https://www.reddit.com//r/politics/comments/1hcnv2f/trump_backtracks_on_campaign_pledge_to_bring_down/,,Reddit
TIL CT scanners are being used to peek inside trading card packs without opening them to assess their value ,Festina_lente123,2024/12/12,https://www.reddit.com//r/todayilearned/comments/1hcqobw/til_ct_scanners_are_being_used_to_peek_inside/,,Reddit
Even said so hinself,blllrrrrr,2024/12/12,https://www.reddit.com//r/WhitePeopleTwitter/comments/1hcndcl/even_said_so_hinself/,,Reddit
A Wedding Party on Acid,Raja_Ampat,2024/12/12,https://www.reddit.com//r/funny/comments/1hcryyv/a_wedding_party_on_acid/,,Reddit
I got a new kitten yesterday. She's been hiding but came out for the first time today! My brave girl. ,Beautiful_Net2409,2024/12/12,https://www.reddit.com//r/cats/comments/1hco1yz/i_got_a_new_kitten_yesterday_shes_been_hiding_but/,,Reddit
I want to hang out with this dude,cleetus76,2024/12/12,https://www.reddit.com//r/ContagiousLaughter/comments/1hcrkg7/i_want_to_hang_out_with_this_dude/,,Reddit
Christmas cookies. Done. I’m so done too. ,PsychoTruffle,2024/12/12,https://www.reddit.com//r/Baking/comments/1hcmud2/christmas_cookies_done_im_so_done_too/,"Haven’t made so many cookies in my life before. But this year I wanted to try my best, since my mum and grandma didn’t want to bake any. This is the outcome. During the whole process I struggled, I was desperate, I was helpless and at some point I just wanted to give up. But I did it. These are my first Christmas cookies ever. My Christmas cookies 2024. ",Reddit
This has me in tears🥺,_mnlght,2024/12/12,https://www.reddit.com//r/wholesome/comments/1hco95c/this_has_me_in_tears/,,Reddit
Humble Bundle's revoked all those Indiana Jones keys it gave away for free (even if it was already in your Steam library),kevro,2024/12/12,https://www.reddit.com//r/gaming/comments/1hcq586/humble_bundles_revoked_all_those_indiana_jones/,,Reddit
When the realization hits ,Hardcorish,2024/12/12,https://www.reddit.com//r/AdviceAnimals/comments/1hcpsbc/when_the_realization_hits/,,Reddit
Pretty eye opening,Fathers_Sword,2024/12/12,https://www.reddit.com//r/antiwork/comments/1hcml7b/pretty_eye_opening/,https://www.newsweek.com/medicare-all-would-save-450-billion-annually-while-preventing-68000-deaths-new-study-shows-1487862,Reddit
"Oh dear, I believe I’m screwed.",metroracerUK,2024/12/12,https://www.reddit.com//r/memes/comments/1hctswt/oh_dear_i_believe_im_screwed/,,Reddit
Meirl,Joudeh_1996,2024/12/12,https://www.reddit.com//r/meirl/comments/1hcmalq/meirl/,,Reddit
Trump strongly opposes US missile strikes deep into Russia,Silly-avocatoe,2024/12/12,https://www.reddit.com//r/worldnews/comments/1hcpicx/trump_strongly_opposes_us_missile_strikes_deep/,,Reddit
Human Fighter,ozangeo,2024/12/12,https://www.reddit.com//r/BaldursGate3/comments/1hct7pr/human_fighter/,,Reddit
Verstappen scored 437 points this season. That is exactly the same as Perez scored in 2023 and 2024 combined. ,OutsideWishbone8,2024/12/12,https://www.reddit.com//r/formula1/comments/1hcs2i6/verstappen_scored_437_points_this_season_that_is/,,Reddit
We were just informed that we don’t get Dec 24th off. ,Crossingthelineagain,2024/12/12,https://www.reddit.com//r/mildlyinfuriating/comments/1hcn36v/we_were_just_informed_that_we_dont_get_dec_24th/,This schedule has been up all year. They just told us that we don’t get that Dec 24th off and took down all the holiday schedules. 2 weeks before Christmas. They forgot one in my area. ,Reddit
Imagine if... ,hiiloovethis,2024/12/12,https://www.reddit.com//r/freefolk/comments/1hcqvp5/imagine_if/,,Reddit
Trump is already backing off campaign promise to lower grocery prices,NutNewz,2024/12/12,https://www.reddit.com//r/PoliticalHumor/comments/1hcsl88/trump_is_already_backing_off_campaign_promise_to/,,Reddit
Madlad paying for wholesome ad,shit-gonna-hit,2024/12/12,https://www.reddit.com//r/madlads/comments/1hcre9m/madlad_paying_for_wholesome_ad/,,Reddit
It's also a faster card,MisteroSix,2024/12/12,https://www.reddit.com//r/pcmasterrace/comments/1hct2zh/its_also_a_faster_card/,,Reddit
🔥 Wildlife photographer gets a close-up,solateor,2024/12/12,https://www.reddit.com//r/NatureIsFuckingLit/comments/1hcm3km/wildlife_photographer_gets_a_closeup/,,Reddit
"20m, Senior Basket Weaver, 35yrs experience",Matrix8000,2024/12/12,https://www.reddit.com//r/Salary/comments/1hco4u0/20m_senior_basket_weaver_35yrs_experience/,,Reddit
Cool idea!,phoenix-007,2024/12/12,https://www.reddit.com//r/comedyheaven/comments/1hcoap7/cool_idea/,,Reddit
Gukesh Dommaraju becomes the youngest World Chess Champion at 18 years of age,noabuelo,2024/12/12,https://www.reddit.com//r/nextfuckinglevel/comments/1hckx5p/gukesh_dommaraju_becomes_the_youngest_world_chess/,,Reddit
What could go wrong taking your stance car to the beach?,0x00000123,2024/12/12,https://www.reddit.com//r/Whatcouldgowrong/comments/1hcnzuw/what_could_go_wrong_taking_your_stance_car_to_the/,,Reddit
A Knicks fan mocks Trae Young as he's leaving the court. Trae goes to dap him up but leaves him hanging. Cold blooded. ,ToronoRapture,2024/12/12,https://www.reddit.com//r/nba/comments/1hcq16h/a_knicks_fan_mocks_trae_young_as_hes_leaving_the/,,Reddit
To promise lower grocery prices.,bigcatcleve,2024/12/12,https://www.reddit.com//r/therewasanattempt/comments/1hcpojx/to_promise_lower_grocery_prices/,,Reddit
youWontUpgradeToJava19,willis7747,2024/12/12,https://www.reddit.com//r/ProgrammerHumor/comments/1hckvb7/youwontupgradetojava19/,,Reddit
So maybe we should have Medicare for all......please?!,Fathers_Sword,2024/12/12,https://www.reddit.com//r/economicCollapse/comments/1hcmntl/so_maybe_we_should_have_medicare_for_allplease/,https://www.newsweek.com/medicare-all-would-save-450-billion-annually-while-preventing-68000-deaths-new-study-shows-1487862,Reddit
And they went after obi wan,fishyboi360,2024/12/12,https://www.reddit.com//r/PrequelMemes/comments/1hcu4jw/and_they_went_after_obi_wan/,,Reddit
"""Come with me if you want healthcare reform""",Thereisonlyzero,2024/12/12,https://www.reddit.com//r/Anticonsumption/comments/1hcs3yj/come_with_me_if_you_want_healthcare_reform/,,Reddit
Prices are such a problem to trump voters that we’d better stock up under Biden before prices go way up under trump!,swissmiss_76,2024/12/12,https://www.reddit.com//r/LeopardsAteMyFace/comments/1hcq7sr/prices_are_such_a_problem_to_trump_voters_that/,,Reddit
Hospital Bill for a 2-Hour ER Visit,highschoolhero2,2024/12/12,https://www.reddit.com//r/FluentInFinance/comments/1hcuuow/hospital_bill_for_a_2hour_er_visit/,I have 3 Kidney Stones. This was the bill for the diagnosis alone. I was referred to a urologist to actually treat the problem so I’m still in agony. Anyone defending this system is either a useful idiot or a parasite that has a financial interest in maintaining the status quo. ,Reddit
AITAH for kicking my brother and his wife out of my house after they demanded I change my baby’s name?,kittyeden,2024/12/12,https://www.reddit.com//r/AITAH/comments/1hcshaa/aitah_for_kicking_my_brother_and_his_wife_out_of/,"My husband (34M) and I (32F) just had our first baby, a beautiful little girl. We named her “Lena” after my late mother, who passed away a few years ago. The name has deep meaning for us, and it felt perfect.My older brother (37M) and his wife (35F) came over to meet the baby for the first time. As soon as they heard her name, my SIL’s face dropped. She said Lena was the name she had “always planned” to use for her future daughter (they don’t have kids yet) and accused us of “stealing” the name.At first, I thought she was joking, but she kept going, saying we were “selfish” and “ruined” the name for her. My brother backed her up and suggested we “consider changing it” since “they called dibs” years ago.I lost it and told them they were being ridiculous and disrespectful, especially since the name honors my mom. When they wouldn’t drop it, I asked them to leave. Now they’re telling our family that I’m “heartless” and “stole their dream name” while “overreacting” by kicking them out.AITAH? 🫠",Reddit
"A seaman's request for an extraordinary leave of absence, 1967. Reason: “My wife is planning to get pregnant this weekend and I would like to be present.”",4reddityo,2024/12/12,https://www.reddit.com//r/BeAmazed/comments/1hck7e7/a_seamans_request_for_an_extraordinary_leave_of/,,Reddit
"You want people to not support CEO killers?  Have you tried Medicare For All or raising the minimum wage? There are no alternatives. Living standards must be raised.  Until then, Luigi is a hero to most Americans.",kevinmrr,2024/12/12,https://www.reddit.com//r/WorkReform/comments/1hckfa5/you_want_people_to_not_support_ceo_killers_have/,,Reddit
YouTube TV Hikes Price 14% to $82.99 ,MarvelsGrantMan136,2024/12/12,https://www.reddit.com//r/television/comments/1hcn9sz/youtube_tv_hikes_price_14_to_8299/,,Reddit
maybe maybe maybe ,samlane927,2024/12/12,https://www.reddit.com//r/maybemaybemaybe/comments/1hcpjq1/maybe_maybe_maybe/,,Reddit
Yoga Pants Problems - Tiff🏳️‍⚧️& Eve,CrazyGnomenclature,2024/12/12,https://www.reddit.com//r/comics/comments/1hco3bk/yoga_pants_problems_tiff_eve/,,Reddit
Prison inmates show solidarity with Luigi Mangione,nikamats,2024/12/12,https://www.reddit.com//r/popculturechat/comments/1hckux5/prison_inmates_show_solidarity_with_luigi_mangione/,,Reddit
Love & kindness make such miraculous transformation. ♥️,Not_NosyCat,2024/12/12,https://www.reddit.com//r/Awww/comments/1hcs90v/love_kindness_make_such_miraculous_transformation/,,Reddit
Go to Work in a Flying Car,Straight_Random_2211,2024/12/12,https://www.reddit.com//r/Damnthatsinteresting/comments/1hcmza5/go_to_work_in_a_flying_car/,,Reddit
Eyewitnesses Say Nancy Mace Called For Man's Arrest After He Shook Her Hand,Lvexr,2024/12/12,https://www.reddit.com//r/nottheonion/comments/1hckgz5/eyewitnesses_say_nancy_mace_called_for_mans/,,Reddit
Art,Green____cat,2024/12/12,https://www.reddit.com//r/KidsAreFuckingStupid/comments/1hcjwkl/art/,,Reddit
I thought this game wasn’t pay to win 😳,-Knucklehead_,2024/12/12,https://www.reddit.com//r/marvelrivals/comments/1hcnr4x/i_thought_this_game_wasnt_pay_to_win/,,Reddit
Oh,intelligence3,2024/12/12,https://www.reddit.com//r/ChatGPT/comments/1hcmjvs/oh/,,Reddit
Mr free speech absolutist,The_Chuckness88,2024/12/12,https://www.reddit.com//r/clevercomebacks/comments/1hcj1h5/mr_free_speech_absolutist/,,Reddit
Bro I just got hacked,Difficult_Company782,2024/12/12,https://www.reddit.com//r/CharacterAI/comments/1hcusfa/bro_i_just_got_hacked/,I never had these chats before and now I have them??? Help???,Reddit
Social anxiety is scared of them,YosoyPabloIscobar,2024/12/12,https://www.reddit.com//r/MadeMeSmile/comments/1hcqbal/social_anxiety_is_scared_of_them/,,Reddit
anime_irl,Ok_Direction3138,2024/12/12,https://www.reddit.com//r/anime_irl/comments/1hcsly6/anime_irl/,,Reddit
Anon is confused ,ZipByte,2024/12/12,https://www.reddit.com//r/shitposting/comments/1hcll5l/anon_is_confused/,,Reddit
who would win ?,Asleep_Fault881,2024/12/12,https://www.reddit.com//r/meme/comments/1hcq8ql/who_would_win/,,Reddit
Hijabi Amputee,Boring-Toe-351,2024/12/12,https://www.reddit.com//r/BrandNewSentence/comments/1hcsxcx/hijabi_amputee/,,Reddit
Always,Visara57,2024/12/12,https://www.reddit.com//r/Piracy/comments/1hco824/always/,,Reddit
Europe 🇪🇺 ,WarCrimesAreBased,2024/12/12,https://www.reddit.com//r/whenthe/comments/1hcmzhr/europe/,,Reddit
My wife and kids left me because of the CoF nerfs ,Nephalos,2024/12/12,https://www.reddit.com//r/PathOfExile2/comments/1hcqhaz/my_wife_and_kids_left_me_because_of_the_cof_nerfs/,"My wife took one look at the patch notes and said to me, “Honey, isn’t this your build?” My heart sank. I quickly logged in and entered a map. “It’s not working, I deal 0 damage.” Okay I prepared for this. I had a small savings account with gold in case of an emergency. I quickly respecced into CoC and looked at my wife nervously. “See? Everything’s alright honey, it was just a little hiccup”. “There was another hotfix. CoC doesn’t work anymore either.” I tested again and she was right. 0 damage and my beautiful trigger comets were in shambles. She suddenly lost all emotion, at that point I knew everything was over. She couldn’t even look me in the eyes anymore. I had no gold, no damage, nothing. I was worthless. Our 13 skeleton kids were in the other room listening but I could tell they all had the same thought. I couldn’t even comfort them because at that point I was completely out of energy. My wife finally spoke up, “I’m going to spend the night at my parent’s. They’re an older build but at least Gas Arrow still works. They have room for the kids, too” She left 3 hours ago. I tried to explain to her that her grandparent were already nerfed but she wouldn’t listen. It’s been less than 24 hours and any help is appreciated. I can’t put gold on the table because my main source of income is gone. I don’t know where I’m going to be in 2 days but I can’t afford the hideout rent and Alva keeps asking me when I’ll pay. I think she just shut off the water because I can’t pay for utilities either. Please, help make this right. ",Reddit
...because he's a tree with a beard          ,Specialist_Cry_6879,2024/12/12,https://www.reddit.com//r/lotrmemes/comments/1hcmqsd/because_hes_a_tree_with_a_beard/,,Reddit
Friends hate this simple trick,m4xf,2024/12/12,https://www.reddit.com//r/LinkedInLunatics/comments/1hclfcj/friends_hate_this_simple_trick/,,Reddit
My hospital bill for a single MRI scan in the US,SilentWalrus92,2024/12/12,https://www.reddit.com//r/pics/comments/1hcrpi9/my_hospital_bill_for_a_single_mri_scan_in_the_us/,,Reddit
I have about a year+/- left. I made an offline browsable archive of my website which is a lifetime of my favorite recipes..,TerrysApplianceSvc,2024/12/12,https://www.reddit.com//r/Cooking/comments/1hcth5f/i_have_about_a_year_left_i_made_an_offline/,"Unfortunately I have incurable brain cancer. I don't want sympathy or money or anything else, it would just be nice if my favorite recipes would last longer than I will. If any of the recipe collectors among you would like to download and or share the offline browsable copy, I'd appreciate it..  there's a link in the right sidebar.Https://bupkis.orgNo ads, no cookies no tracking, no nothing it's just my favorite recipesSorry to bother you all. It seems like everybody has years and years and years left, right up until they don't.**Edit**It turns out that at the end of the road, the things that really mattered were good times with friends and family, And these were almost all in the kitchen. I've gotten to be relatively old, and finding out what I have certainly was not a happy thing, but given the number of my friends over the years that died with no notice from a heart attack or vehicle accident or whatever, this weirdly seems like a bit of a gift that I know what's coming and have some idea of a timeline. Although not really good idea. Go home make yummy food and have your friends and family over. Actual happy memories are all that matters, money, power, status, everything else is mostly all nonsense.",Reddit
It took his mum dying for insurance to cover her needs.,mindyour,2024/12/12,https://www.reddit.com//r/TikTokCringe/comments/1hck07w/it_took_his_mum_dying_for_insurance_to_cover_her/,,Reddit
A question of life or death,Green____cat,2024/12/12,https://www.reddit.com//r/oddlyspecific/comments/1hcjrmo/a_question_of_life_or_death/,,Reddit
I think it's important to be honest with feedback so I am going to directly say that Kobo's arms do not look good here,MajorFamilyDisgrace,2024/12/12,https://www.reddit.com//r/Hololive/comments/1hcq5f4/i_think_its_important_to_be_honest_with_feedback/,,Reddit
Black snake wrap by @nyouung in Seoul at studio Kodzunak! ,goddessflili,2024/12/12,https://www.reddit.com//r/tattoos/comments/1hcp7ja/black_snake_wrap_by_nyouung_in_seoul_at_studio/,Most painful 2 days of my life getting this snake wrap!! It was a coverup of two shitty tattoos I had on my chest and rib from when I was way too young. I approached him with a request to cover the two up and he took full creative liberty and freehanded a design to fit. Artist's IG: nyouung ,Reddit
Rescued our first kitten in the wilds of W Virginia motels,curveabrae,2024/12/12,https://www.reddit.com//r/aww/comments/1hcubhd/rescued_our_first_kitten_in_the_wilds_of_w/,,Reddit
jinx was actually insane for this no wonder caitlyn is so traumatized by her,Anarkoi,2024/12/12,https://www.reddit.com//r/arcane/comments/1hclolq/jinx_was_actually_insane_for_this_no_wonder/,,Reddit
Nancy Mace forgot to use her burner account ,FalconLynx13,2024/12/12,https://www.reddit.com//r/insanepeoplefacebook/comments/1hco5xi/nancy_mace_forgot_to_use_her_burner_account/,,Reddit
I'll be a little disappointed if SNL doesn't find the guts to make this happen.,Sure-Ad-2465,2024/12/12,https://www.reddit.com//r/LiveFromNewYork/comments/1hcrlz1/ill_be_a_little_disappointed_if_snl_doesnt_find/,,Reddit
Stolen right from their facebook,udmurrrt,2024/12/12,https://www.reddit.com//r/MetalMemes/comments/1hcip15/stolen_right_from_their_facebook/,,Reddit
my mom turned all the makeup packaging I've been hoarding into an art piece ,psntr888,2024/12/12,https://www.reddit.com//r/Sephora/comments/1hcq8ta/my_mom_turned_all_the_makeup_packaging_ive_been/,"I've been keeping makeup boxes for years because they're just too pretty to throw away. My mom came up with the idea to stick them all together and turn them into an art piece, and I absolutely love how it turned out! It feels so creative and meaningful. Has anyone else done something similar with old packaging? I'd love to see :)",Reddit
Iraq in the 70s,Idangada,2024/12/12,https://www.reddit.com//r/OldSchoolCool/comments/1hcuhn8/iraq_in_the_70s/,,Reddit
Beru 💀,NoFee6952,2024/12/12,https://www.reddit.com//r/StarWars/comments/1hckocg/beru/,,Reddit
"Before, What I Wanted, What I Got",SpaceSyncMusic,2024/12/12,https://www.reddit.com//r/Justfuckmyshitup/comments/1hcq0rw/before_what_i_wanted_what_i_got/,,Reddit
They really believe they have the ultimate machine,kingamenra,2024/12/12,https://www.reddit.com//r/CyberStuck/comments/1hcmcv9/they_really_believe_they_have_the_ultimate_machine/,,Reddit
Object Impermanence,dacoolestguy,2024/12/12,https://www.reddit.com//r/CuratedTumblr/comments/1hcswyt/object_impermanence/,,Reddit
[Request] What is the area of this shape if the side length is 4?,ZealousidealTie8142,2024/12/12,https://www.reddit.com//r/theydidthemath/comments/1hcthzm/request_what_is_the_area_of_this_shape_if_the/,,Reddit
Peasants ,CapitalProgrammer713,2024/12/12,https://www.reddit.com//r/StrangeAndFunny/comments/1hcjs2q/peasants/,,Reddit
"When I stepped out from my therapy session last night, in Michigan USA",PartyMushroom1723,2024/12/12,https://www.reddit.com//r/TheNightFeeling/comments/1hcp3u2/when_i_stepped_out_from_my_therapy_session_last/,,Reddit
Entitled Karen attempts to push fisherman into a lake.,G0LDLU5T,2024/12/12,https://www.reddit.com//r/instantkarma/comments/1hcr2n6/entitled_karen_attempts_to_push_fisherman_into_a/,,Reddit
I wish there was some solution to this,IAmAccutane,2024/12/12,https://www.reddit.com//r/SipsTea/comments/1hcu42i/i_wish_there_was_some_solution_to_this/,,Reddit
me_irlgbt,OnceInOnceSet,2024/12/12,https://www.reddit.com//r/me_irlgbt/comments/1hcq01d/me_irlgbt/,,Reddit
[40][42x3][43][44] New lease on life after divorce,Hella3D,2024/12/12,https://www.reddit.com//r/GlowUps/comments/1hcrxk6/4042x34344_new_lease_on_life_after_divorce/,Crazy how much stress and unhappiness affects your body. Lost around 40lbs within 4 months after I  filed for divorce. Feel like myself again. ,Reddit
Asians and their advanced technology,olivi_reyes,2024/12/12,https://www.reddit.com//r/NonPoliticalTwitter/comments/1hcin5r/asians_and_their_advanced_technology/,,Reddit
Nobody in Falkreath questions this door?,ParthenopeIG,2024/12/12,https://www.reddit.com//r/skyrim/comments/1hcqgp5/nobody_in_falkreath_questions_this_door/,Not a single person in Falkreath ever decided to walk off the path and wondered why the door talks or let alone who has access to it?,Reddit
Key Witness Reveals He Lied About Biden Corruption | Alexander Smirnov admitted he fabricated the conspiracy that Joe Biden and his son Hunter had made millions from a Ukrainian energy company.,thenewrepublic,2024/12/12,https://www.reddit.com//r/politics/comments/1hctigw/key_witness_reveals_he_lied_about_biden/,,Reddit
We were warned this would happen ,Glittering_Bee_6397,2024/12/12,https://www.reddit.com//r/tf2shitposterclub/comments/1hcsmk9/we_were_warned_this_would_happen/,,Reddit
Petahhhhhh,NoReward6072,2024/12/12,https://www.reddit.com//r/PeterExplainsTheJoke/comments/1hcl54a/petahhhhhh/,I get its some sort of maths and whatever he did I guess is wrong? But why? Thanks peta - Louis ,Reddit
Texas Nazi shot in head. Just one shot fired. Investigators still haven’t determined what the motive was. ,OnlyUsersLoseDrugs1,2024/12/12,https://www.reddit.com//r/texas/comments/1hcn867/texas_nazi_shot_in_head_just_one_shot_fired/,"Bolted for life, but left for dead 💀 Obituary photos show SS and face of Hitler tattoo. ",Reddit
Ive never watched peppa ,KarenReviewsWorstREV,2024/12/12,https://www.reddit.com//r/ExplainTheJoke/comments/1hcpvbz/ive_never_watched_peppa/,,Reddit
"I see a lot of posts here regarding customer allergies, was curious how you would react in this type situation. I think the waiter did well.",MonsterDrinker69,2024/12/12,https://www.reddit.com//r/KitchenConfidential/comments/1hcpu5r/i_see_a_lot_of_posts_here_regarding_customer/,,Reddit
When your cat bench presses more than you,glitteringrosebliss,2024/12/12,https://www.reddit.com//r/FunnyAnimals/comments/1hckt01/when_your_cat_bench_presses_more_than_you/,,Reddit
